sentence,fuel,machine,others,part,price,service
" xenia xi sporty menawi pas nyugengaken ac , suwanten mesinipun   berisik sanget ",neutral,negative,neutral,neutral,neutral,neutral
 avanza kenyamananipun   paling juwara ,neutral,neutral,positive,neutral,neutral,neutral
" kagungan hrv e 2018 , tenaganipun  ugi  lumayan ",neutral,positive,neutral,neutral,neutral,neutral
 karimun wagon r cocog  kebetahan  &  budget mawon supados tetep saged menikmatinipun  lan mboten menggangu kebetahan sanesipun   ,neutral,neutral,neutral,neutral,positive,neutral
" avanza menika bodinipun  saya  sae   , miyos irit bahan besmi , onderdil kathah lan mirah , ukuran miyos lega , gampil dipunsade , regi  sade inggil , dipunasta kondur kampung eca  , perawatan mirah . miyos elegan . ",positive,neutral,positive,positive,positive,positive
 honda brio miyos worth it menawi kajeng mobil ingkang fun to drive ,neutral,neutral,positive,neutral,neutral,neutral
" avanza menika amargi bobotipun   miyos ringan juragan , ",neutral,neutral,neutral,positive,neutral,neutral
" yamaha 125 zr sanes mboten pajeng  , reginipun   kraos  wonten awang-awang ",neutral,neutral,neutral,neutral,negative,neutral
 gadhah artos mesin xenia kebukti  sae   lan bandel + irit bbm ,positive,positive,neutral,neutral,neutral,neutral
" midherek kula veloz mboten seindah menika om , mboten wonten nyaman-nyamanipun   menawi dibandingin lawan2ipun   . ",neutral,neutral,negative,neutral,neutral,neutral
 kula kagungan mobil rentalan 50 biji xenia umuripun   sampun 3 warsa sedaya setunggal nggih mboten wonten ingkang meledak mesinipun   . ,neutral,positive,neutral,neutral,neutral,neutral
" nggih estu   xpander , fasilitas servisipun   ugi  sae   sanget ",neutral,neutral,neutral,neutral,neutral,positive
 salah setunggal ingkang kula remen saking yamaha inggih menika after sales servicenipun  ,neutral,neutral,neutral,neutral,neutral,positive
 sedaya produk nissan pajeng  atos|sora wonten pasaran . ,neutral,neutral,positive,neutral,neutral,neutral
" sadangu 2 warsa dereng wonten pambengan, sigra estu   mantep. ",neutral,neutral,positive,neutral,neutral,neutral
" kasunyatanipun pelayanan bengkel-bengkel yamaha asli awon  sanget , kula bagusin stater hand dumugi wongsal-wangsul naming asih  arta dhateng bengkelipun   nanging tetep mboten saged dipunagem stater kula . ",neutral,neutral,neutral,neutral,neutral,negative
 aduh dados nyesel ngambil alya ,neutral,neutral,negative,neutral,neutral,neutral
 masa kula mrika wekdal dinten nyambut damel pekerjanipun  naming sakedhik kados pundi menika pelayanan saking daihatsu damel pelangganipun   ,neutral,neutral,neutral,neutral,neutral,negative
 mesin avanza ugi  bertenaga juragan . ,neutral,positive,neutral,neutral,neutral,neutral
" altis g 2003 mt , mesin raosipun   powerful sanget wonten rpm 2.500 nggih mantep . ",neutral,positive,neutral,neutral,neutral,neutral
 bingah sanget kula kagungan mobil xenia menika sanadyan reginipun   awis  . ,neutral,neutral,positive,neutral,negative,neutral
 pilihan warni brio lucu-lucu sedaya bingung pilih pundi ,neutral,neutral,neutral,positive,neutral,neutral
 kula ngagungani motor vespa sprint menika inggih menika motor ingkang kula agem saking sma wekdal nalika menika motor paling keren sae   lan bagus   deh pokokipun   reginipun   mitran     ,neutral,neutral,positive,neutral,positive,neutral
 cocok sanget avanza kagem dipunasta liburan sareng  keluwargi nyaman sanget ,neutral,neutral,positive,neutral,neutral,neutral
" eca  ugi  niki xenia 1000 cc , irit lan lincah hehe ",positive,positive,positive,neutral,neutral,neutral
" suspensi toyota calya nyaman , amot kathah , inline 4 silinder kaliyan vvt -i technology saged damel taksi daring ",neutral,neutral,neutral,positive,neutral,neutral
" ertiga gayanipun  oke sanget, tarikan ugi  mantep lan bandel nanging sayangipun   boros sanget ",negative,positive,neutral,positive,neutral,neutral
" daihatsu xenia ingkang paling pas kagem kula lan keluwargi , perawatan miyos gampil lan part miyos mirah saking kendaraan merek sanesipun   . ",neutral,neutral,positive,positive,neutral,positive
 sumpah . gtr bagus   sanget asli ,neutral,neutral,positive,neutral,neutral,neutral
 kagem kula kagem ukuran ekonomi menengah dhateng ngandhap nggih toyota calya oke sanget reginipun   ,neutral,neutral,neutral,neutral,positive,neutral
 kaliyan kwalitet ingkang dipunparingaken  &  regi  ingkang mirah midherek kula sanget sanget worth to buy pisan  ignis menika ,neutral,neutral,positive,neutral,positive,neutral
 agem new avanza bu . boros bensin haha ,negative,neutral,neutral,neutral,neutral,neutral
 cooper alit  nanging awis  ,neutral,neutral,neutral,neutral,negative,neutral
 mboten nate   bosan kula agem vario kagem tindak dhateng kampus . ,neutral,neutral,positive,neutral,neutral,neutral
" regi  awis  , nanging fitur ngoten ngoten mawon . ",neutral,neutral,neutral,negative,negative,neutral
" yamaha lexi speedipun   ewah, tarikanipun   juwara, naming yah, bensinipun   nyedot, bro. ",negative,positive,neutral,neutral,neutral,neutral
" remen  kula sami xenia li. miyos arta mboten kathah , dapatipun   mantep . ",neutral,neutral,positive,neutral,positive,neutral
 honda hrv gasipun   alon  wonten ratan mboten radin ungel sedaya . ,neutral,negative,neutral,neutral,neutral,neutral
" xenia menika mobil irit oli ( naming 2 liter ) , irit sparepart ( sparepart ipun    naming sakedhik ) . ",positive,neutral,neutral,positive,neutral,neutral
 interior mobil avanza veloz ugi  sampun dipundamelaken kabin avanza veloz kaliyan tampilan ingkang miyos modern lan elegan ,neutral,neutral,neutral,positive,neutral,neutral
 kantenan design mazda cx -3 miyos cakep diliat saking ngajeng sisi    lan wingking ,neutral,neutral,neutral,positive,neutral,neutral
" sadangu menika mboten nate   wonten masalah lan estu   mesinipun   tanggen lan bandel sae  kagem {margi, mlampah} menanjak wonten pareden    . pokokipun   avanza paling sae . ",neutral,positive,positive,neutral,neutral,neutral
" desain interior tebih lbh simpel , elegan lan berkelas cx3 saking chr ingkang terkesan ribet ",neutral,neutral,neutral,negative,neutral,neutral
" payah , bengkel honda resmi mboten becus ... wonten ngriki malah miyos ngertos . ",neutral,neutral,neutral,neutral,negative,neutral
 jazz tarikanipun   miyos oke daripada brio ,neutral,negative,neutral,neutral,neutral,neutral
 midherek kula sih saking segi pandengan soca brio menika mewah sanadyan minim fitur lan saking gengsinipun  ugi  benten  ,neutral,neutral,positive,negative,neutral,neutral
 samparan samparan hrv kados mboten kokoh ,neutral,neutral,neutral,negative,neutral,neutral
 ignis menika city car paling terjangkau kaliyan poin-poin wonten inggil ,neutral,neutral,neutral,neutral,positive,neutral
 kaliyan sedayanipun avanza sae   kejawi  pangageman bensin ingkang boros sanget ,negative,neutral,positive,neutral,neutral,neutral
" kelemahanipun   naming setunggal , shockipun   atos|sora atos|sora atos|sora atos|sora atos|sora ",neutral,neutral,neutral,negative,neutral,neutral
 badhe pesaing enggal ingkang buanyak ingkang miyos lan model sami fitur ingkang miyos seger . tetep avanza menika wonten ing panggalih ,neutral,neutral,positive,neutral,neutral,neutral
" bensin 1:15 jawining kitha ( sampun irit sanget kan ) gesit wonten penggokan , naming taksih standar . ",positive,positive,neutral,neutral,neutral,neutral
 remen sanget xenia perawatan mirah pangageman gampil sparepart oke . ,neutral,neutral,positive,positive,neutral,positive
" gede sanget niki kapasitas avanza, volume ruanganipun   sepen   ",neutral,neutral,neutral,positive,neutral,neutral
" kula kagungan avanza g 2008 , enggal juni kala-wingi kula mundhut saking tunas toyota . terus kopling sampun radi awrat mawon ",neutral,neutral,neutral,negative,neutral,neutral
 kula enggal pundhut hrv prestige akhir warsa 2017 . sedayanipun eca  dikendarai . ,neutral,neutral,positive,neutral,neutral,neutral
" wah, wuling formo saking mesin 1200 cc menarik kaliyan regi  ingkang kompetitif. ",neutral,positive,neutral,neutral,negative,neutral
 kula ugi  remen  sanget soalipun   avanza ruang bagasinipun  kuwawi nampung   ngantos 5 tas ukuran    ageng kaliyan susunan rapi dhateng arah inggil . asta barang kathah nggih mesthi amot ,neutral,neutral,neutral,positive,neutral,neutral
 fitur keamanan menika cekap nginggahaken kasta avanza supados setara kaliyan low mpv sanesipun  ingkang miyos rumiyin ngagem toya bag keren nggih ,neutral,neutral,neutral,positive,neutral,neutral
" masa konsumsi bensin toyota avanza veloz 12,5 liter per kilometer , boros sanget segawon",negative,neutral,neutral,neutral,neutral,neutral
menawi mboten kersa boros sampun mundhut scoopy ,negative,neutral,neutral,neutral,neutral,neutral
" menawi down shifting terus gaspol menika raosipun   naming minggah rpm mawon, nanging power kosong lan estu   mesinipun   asring ngelitik. ",neutral,negative,neutral,neutral,neutral,neutral
 kula remen fortuner amargi lincah mlajengipun daripada ertiga ingkang tenaganipun  ringkih ,neutral,negative,neutral,neutral,neutral,neutral
 mending pajero simple mboten kathah-kathah desain ,neutral,neutral,neutral,positive,neutral,neutral
" wuling inggih menika mobil ingkang bandel wonten sedaya medan , irit bahan besmi , desain ingkang dinamis lan mewah dipuntambah kaliyan regi  ingkang pastinipun  terjangkau ",positive,positive,neutral,positive,positive,neutral
 xpander menika mpv paling sae   kagem tiyang ingkang pados mobil mpv canggih ,neutral,neutral,positive,neutral,neutral,neutral
" kados menika tiyang nglirik xpander , kesanipun   mesthi keren desainipun   ",neutral,neutral,neutral,positive,neutral,neutral
 koh saya  awon  mawon nggih pelayanan wonten ahas padhang anugerah pamulang ,neutral,neutral,neutral,neutral,neutral,negative
" nate   agem avanza dhateng jawining kitha saking enjing dumugi sonten , mesin lan ac nyala tanpa mendel , nanging mboten nedhak ",neutral,positive,neutral,positive,neutral,neutral
 menawi mesin lan tampang inggil brio satya . nanging miyos empuk lan miyos mirah karimun . ,neutral,positive,neutral,positive,positive,neutral
 toyota avanza veloz enggal inggih menika ngagem mesin dual vvt -i ingkang saderengipun  ngagem single vvt -i. juragan mantep ,neutral,positive,neutral,neutral,neutral,neutral
" @daihatsuind service wonten bengkel daihatsu reginipun   awis  sanget , onderdil taksih sae   nyuwun dipun-gantos sami cs / mekanikipun   . pisan  service 2jt ",neutral,neutral,neutral,neutral,neutral,negative
 mobilio cemeng menika cekap ndamel  tiyang heran lan ngagemipun nggih kraos  gagah ,neutral,neutral,positive,neutral,neutral,neutral
 brio paling cocok kagem mahasiswa amargi stylenipun  ingkang simpel lan minimalis ,neutral,neutral,neutral,positive,neutral,neutral
 kula sopir operasional . agem altis v. kagem mesin kula akeni eca  . tarikan mantep handling ipun    wow . ,neutral,positive,neutral,positive,neutral,neutral
 xenia xi sporty kaliyan sedayanipun marem sami menika mobil ,neutral,neutral,positive,neutral,neutral,neutral
 pilihan dhawah dhateng xenia amargi faktor regi  lan servis xenia mesthi miyos mirah hehe . ,neutral,neutral,neutral,neutral,positive,positive
 vario bodyipun   miyos kokoh daripada mio ,neutral,neutral,neutral,negative,neutral,neutral
 agya mobil ingkang sae   lan keren gayanipun  ,neutral,neutral,positive,positive,neutral,neutral
" masa kedah dumugi sawarsa naming damel inden xpander, kecewa ! ",neutral,neutral,neutral,neutral,neutral,negative
 sadangu menika agem xexi lumayan irit ,positive,neutral,neutral,neutral,neutral,neutral
" kenyamanan tebih menang xpander , miyos kedap  &  bantingan nyaman sanget . regi  ugi  miyos mirah ",neutral,neutral,positive,neutral,positive,neutral
 tampilan desain dasbor interior avanza kepriksan miyos mewah lan stylish ,neutral,neutral,neutral,positive,neutral,neutral
 rush performa mesinipun   ugi  mboten kawon kaliyan suv benten ,neutral,positive,neutral,neutral,neutral,neutral
" sampun dangu agem xenia , enggal kali keparing ingkang ac ipun    mboten eca  lan jokipun   kaken   . ",neutral,neutral,neutral,negative,neutral,neutral
" sampun mundhut ingkang 2019 nanging wonten 1 kekirangan , jokipun   kirang nyaman ",neutral,neutral,neutral,negative,neutral,neutral
" honda beat street inggih menika motor ingkang saged dipunaturaken mirah , nanging sanes mirahan . amargi kejawi keren , ugi  gampil  sanget kagem dimodifikasi . ",neutral,neutral,positive,neutral,positive,neutral
 jok penumpang mobil wuling formo kepriksan nyaman ,neutral,neutral,neutral,positive,neutral,neutral
" koh nissan gl mboten sanget , deh . ",neutral,neutral,negative,neutral,neutral,neutral
" xenia 1:8 -9 boros ugi  nggih juragan , amargi bodi agengipun   lan cc alit  mungkin nggih . ",negative,neutral,neutral,neutral,neutral,neutral
 dhateng pundi-pundi badhe jarak celak/caket utawi nggih tebih tetep nyaman agem scooy . muatan bagasi kathah lan mesin mboten enggal benter . ,neutral,positive,positive,positive,neutral,neutral
" kula kagungan grand livina xv warsa 2011 iritipun   juwara , bang . ",positive,neutral,neutral,neutral,neutral,neutral
" eca  sih agem brio , pasaranipun   ugi  stabil ",neutral,neutral,positive,neutral,positive,neutral
 kenyamanan vario miyos inggil dipunbanding mio . ,neutral,neutral,negative,neutral,neutral,neutral
 li biru dlx regi  jualipun   nggih inggil . mundhut warsa 2004 sawentawis 80 jutaan dipunsade 2009 90 jutaan . untung juragan . ,neutral,neutral,neutral,neutral,positive,neutral
 pajero oh   empun bagus   jawinipun  tenaganipun  ugi  keparing ,neutral,positive,neutral,positive,neutral,neutral
" kula agem all new honda brio satya e juragan , nyaman sanget lan sae   , menapa malih brand ipun    h , regi  jualipun   ugi  tetep stabil ",neutral,neutral,positive,neutral,positive,neutral
 xenia bodinipun  sampun oke tilar   gantos samparan samparan mawon mugi-mugi modifikasi panjenengan ngremenaken  ,neutral,neutral,neutral,positive,neutral,neutral
 midherek ane soal kenyamanan kantenan all new pajero sport inggil tebih miyos nyaman dipunbandingaken all new fortuner ingkang atos|sora sanget midherek ane ,neutral,neutral,negative,neutral,neutral,neutral
 pungkasanipun kula mundhut avanza amargi bandel jahat reginipun   ugi  pas wonten kantong ,neutral,positive,neutral,neutral,positive,neutral
" tetep mawon mobilio taksih inggih menika mobil mpv keluwargi kelas menengah dhateng ngandhap ingkang paling paling sae dipunbanding kompetitoripun   , bbm paling irit , kabin paling lega dumugi baris dhateng 3 , model paling manis , mesin ugi  paling kenceng saking kompetitoripun   , desain interior ugi  paling cakep saking kompetitoripun   . ",positive,positive,positive,positive,neutral,neutral
 mboten heranlah juragan amargi avanza kagungan fitur ingkang cekap jangkep kaliyan regi  mboten sanget-sanget awis  ,neutral,neutral,neutral,positive,positive,neutral
 kula agem xpander amargi mboten mirahan . ,neutral,neutral,positive,neutral,neutral,neutral
 after sales service yamaha tansah ngajengaken   customer daripada kagem untung     piyambak ,neutral,neutral,neutral,neutral,neutral,positive
 tenaga fortuner kawon tebih lah . pajero sport mobil paling tanggen ,neutral,positive,neutral,neutral,neutral,neutral
" si gesit irit motor honda beat series warsa 2011 ingkang tansah setya ngancani kula lebet madosi  rezeki wonten kala benter lan jawah , siyang lan dalu  . ",positive,positive,neutral,neutral,neutral,neutral
" menawi saking segi desain mah veloz juwaranipun, avanza kelangkung tebih ",neutral,neutral,neutral,negative,neutral,neutral
 toyota calya estu   cocok kagem keluwargi hemat sanget bbm irit sanget eca  dipunagem ,positive,neutral,positive,neutral,neutral,neutral
 ertiga saestu  gampil dipakainipun  ,neutral,neutral,positive,neutral,neutral,neutral
 mboten getun    ugi  pundhut mobil honda mboten kawon bandel irit tahan banting sampun agem jazz ,positive,positive,neutral,positive,neutral,neutral
 fortuner sparepartipun   gampil  dipunpanggihaken wonten pundi mawon ,neutral,neutral,neutral,positive,neutral,neutral
" sasampunipun priksa wuling almaz , priksa mobilio sami veloz dados kados sampah .. ",neutral,neutral,negative,neutral,neutral,neutral
" kula dados   pangagem kidang innova mboten rumaos kecewa lan marem sanget , perawatan nggih mboten patos awis  pokokipun   mantep . ",neutral,neutral,positive,neutral,neutral,positive
 menawi wonten dhawuhi milih . kantenan milih cx 3 oh   ,neutral,neutral,positive,neutral,neutral,neutral
" kasunyatanipun service bengkel toyota payah , angin ban sanesipun   dipuntambah malah disemir mawon kagem menapa cobi . jelas-jelas kirang angin ngoten ",neutral,neutral,neutral,neutral,neutral,negative
 desain velg alloy veloz ugi  dipunebah juragan kagem kula desainipun   sae   sanget lan terkesan sporty juragan ,neutral,neutral,neutral,positive,neutral,neutral
 beat cekap ekonomis kagem mahasiswa ,neutral,neutral,neutral,neutral,positive,neutral
 estu   xenia maknyus . ,neutral,neutral,positive,neutral,neutral,neutral
 ewah sih menika xenia bandelipun   juwara dipunagem damel rame-rame ugi  tetep bandel ,neutral,positive,neutral,neutral,neutral,neutral
 ingkang miyos menenangkan saking daihatsu terios inggih menika hemat bahan besmi . ,positive,neutral,neutral,neutral,neutral,neutral
" fortuner model bapak bapak , pajero model putra timur ",neutral,neutral,neutral,positive,neutral,neutral
 menawi kula miyos pilih datsun cross . regi  miyos mirah body miyos keker ,neutral,neutral,neutral,positive,positive,neutral
" chr design gado2 , kraos  liat pinten-pinten mobil dicomot2 ",neutral,neutral,neutral,negative,neutral,neutral
 wah mirah niki . pawitan dp mawon . saged kagem grab car niki . mirah meriah taksih bisalah kagem dados grab car . ,neutral,neutral,neutral,neutral,positive,neutral
" karimun wagon mawon bang , miyos mirah ",neutral,neutral,neutral,neutral,positive,neutral
" honda naming menang wonten mesin , menawi fitur lan interior mah jahat ... lan awis  , jokipun   tipissss damel tepos menawi {margi, mlampah} dangu ",neutral,positive,neutral,negative,negative,neutral
 avanza eca  dipunagem . cocok sanget damel mobil keluwargi . reginipun   mboten patos awis  damel mobil kaliyan spesifikasi ingkang lumayan . ,neutral,neutral,positive,neutral,positive,neutral
 avanza veloz 1.5 type 1.5 gipun   mawon mboten pajeng  sanget lan mboten nate   kepriksan wonten ratan ,neutral,neutral,negative,neutral,neutral,neutral
" duh ni bengkel mitsubishi , awon  kali sih . kados kandang mawon bengkelipun   . ",neutral,neutral,neutral,neutral,neutral,negative
 bengkel @hondaarista jatinegara not recommended . payah . sampun booking servis nanging dipundhawuhi mengantri . ,neutral,neutral,neutral,neutral,neutral,negative
 konsumsi bahan besmi ingkang cekap irit midherek kula inggih menika poin wigatos saking calya menika . ,positive,neutral,neutral,neutral,neutral,neutral
 avanza nyengkuyung sanget profesi ingkang kula lampahi amargi bbm ipun    irit . ,positive,neutral,neutral,neutral,neutral,neutral
 menika ruang tengga bengkel @toyotaid paling nyaman . meh    3 tabuh lan taksih kraos . pelayanan ramah . ecanipun   kagungan toyota . ,neutral,neutral,neutral,neutral,neutral,positive
 xenia 1.300 cc mesinipun   lincah lan saged rame-rame     hehe . ,neutral,positive,positive,neutral,neutral,neutral
" tanduk logo mawon , regi  minggah dasanan yuta ",neutral,neutral,neutral,neutral,negative,neutral
 avanza ugi  tamtunipun  nyaman dikendarai . ,neutral,neutral,positive,neutral,neutral,neutral
" mobil menika sanget-sanget over price bos , untung menang merek ",neutral,neutral,neutral,neutral,negative,neutral
 suzuki karimun gx mboten naming bandel lan ngagungani kabin wiyar nanging ugi  irit ,positive,positive,neutral,positive,neutral,neutral
 all -new brio kaliyan regi  termurah 135 -an yuta mboten prayogi . ,neutral,neutral,neutral,neutral,negative,neutral
 sasampunipun priksa menika kula  saestu badhe mundhut honda cr -v,neutral,neutral,positive,neutral,neutral,neutral
grand livina xv at 2008 ngelitikipun   jahat mas/jeng samenika ugi  lumayan boros ,negative,negative,neutral,neutral,neutral,neutral
 gua miyos pilih fortuner amargi tampilanipun   gagah mboten kados   pajero ,neutral,neutral,negative,neutral,neutral,neutral
 tindak nyambut damel saben  dinten miyos eca  agem honda vultus. ,neutral,neutral,positive,neutral,neutral,neutral
 driver miyos nyaman kaliyan posisi perseneling ingkang unik. matur nuwun  sigra. ,neutral,neutral,neutral,positive,neutral,neutral
" midherek kula kagem service , honda miyos sae   saking nissan . ",neutral,neutral,neutral,neutral,neutral,negative
" mobil ingkang cocok sanget lan nyaman sanget dipunagem wekdal sareng  keluwargi , suwanten mesin ingkang lembat , eksterior ingkang nyaman dipunpriksani , interioripun   ugi  menarik , kejawi menika hemat bahan besmi . ",positive,positive,positive,positive,neutral,neutral
 mboten lepat pilih avanza . sampun 10 warsa mobil avanza kula taksih saged melaju kenceng kaliyan optimal . ,neutral,positive,neutral,neutral,neutral,neutral
" avanza kanca paling sae kagem wonten sedaya medan margi   , plus reginipun   taksih terjangkau . ",neutral,neutral,positive,neutral,positive,neutral
 mesin bandel lan irit dados   alesan kathah keluwargi wonten indonesia milih   agya dados   mobil pertami piyambakipun sedaya ,positive,positive,neutral,neutral,neutral,neutral
 jakarta -bandung agem xenia naming 1 sapalih  tabuh . estu    mesin ingkang tanggen sanget . ,neutral,positive,neutral,neutral,neutral,neutral
 kula sih kaliyan pribadi marem sanget sami xeli . nyaman . ,neutral,neutral,positive,neutral,neutral,neutral
" kula nate   agem karimun saderengipun mobil kula ingkang samenika , midherek kula menika lcgc paling nyaman , paling mirah ",neutral,neutral,positive,neutral,positive,neutral
 kelemahan daihatsu sigra inggih menika bodinipun  ringkih lan kirang kedap suwanten jawi. ,neutral,neutral,neutral,negative,neutral,neutral
" toyota avanza , low mpv kaliyan jaringan penjualan lan purnajual paling kathah ",neutral,neutral,positive,neutral,positive,neutral
 xenia ingkang 1000 cc kagungan handling ingkang miyos lincah lan enteng ,neutral,neutral,neutral,positive,neutral,neutral
 vario bentukipun   seksi damel boncengan nggih nyaman lan aman sistem sedaya sampun canggih lan bbm irit wonten dompet kula lan panjenengan sami . ,positive,neutral,neutral,positive,neutral,neutral
" awalipun   kula mundhut motor ing  warsa 2016 , alhamdulillah ngantos samenika motor kula taksih irit lan tanggen wonten ratan ",positive,positive,neutral,neutral,neutral,neutral
 menawi dipunbandingaken saking segi servicenipun  nissan tebih miyos inggil daripada toyota ingkang asal-asalan ,neutral,neutral,neutral,neutral,neutral,negative
 trose tiyang ingkang xi malah miyos irit saking ingkang li niki . ,negative,neutral,neutral,neutral,neutral,neutral
 cobi mawon dipunbandingaken damel plajeng mesthi brio miyos lincah daripada calya ,neutral,negative,neutral,neutral,neutral,neutral
" kagem kula piyambak ingkang sampun ngagungani terios x deluxe mt , kula cekap marem menapa ingkang sampun kula kagungani matur nuwun  daihatsu ",neutral,neutral,positive,neutral,neutral,neutral
 mobil kula  xenia 1.300 cc irit dipakainipun  ,positive,neutral,neutral,neutral,neutral,neutral
 toyota rush gagah lan tanggen wonten medan ingkang terjal sapisana  lan nyaman wonten ratan ingkang mulus . ,neutral,neutral,positive,neutral,neutral,neutral
 mobilio tarikan lembat sanget menang telak daripada agya kawon tebih ,neutral,negative,neutral,neutral,neutral,neutral
 scoopy keren sanget bodyipun   ugi  unik lan cocok damel putra timur kebak gaya ,neutral,neutral,positive,positive,neutral,neutral
 avanza 1.3 l estu   irit menawi dipunasta 60 -80 km / tabuh . ,positive,neutral,neutral,neutral,neutral,neutral
 kenging menapa sekelas fortuner dereng wonten sunroofipun   nggih ,neutral,neutral,neutral,negative,neutral,neutral
 reginipun   4x4ipun   fortuner miyos worth it wonten banding pajero sport ,neutral,neutral,neutral,neutral,negative,neutral
 menawi brio senyaman menika mboten papa badhe macet dangu ugi  tetep kraos wonten lebet ,neutral,neutral,positive,neutral,neutral,neutral
" midherek kula mawon niki , pasuryan enakan sirion , kagem pocong eca  brio ",neutral,neutral,neutral,positive,neutral,neutral
 pengalaman kala-wingi sewa rental wonten bali koplingipun   radi inggil dados pas inggah-inggah radi menahan-nahan kados menika kirang gesit padahal karimun ,neutral,neutral,neutral,negative,neutral,neutral
" motor honda beat matic ingkang setunggal menika midherek kula  estu   cocok damel sadayaning kalangan , saking segi regi  ingkang mirah nanging mboten ndamel  produk menika asal-asalan . ",neutral,neutral,positive,neutral,positive,neutral
 tampilan avanza bergaya kas  crossover menika ngagungani kesan sporty lan agresif ,neutral,neutral,neutral,positive,neutral,neutral
 nggih sampun kula mboten ragu-ragu pundhut calya menika damel dintenan ,neutral,neutral,positive,neutral,neutral,neutral
 soalipun   midherek kula wuling confero s 1.5 tipe paling inggil reginipun   miyos mirah naming 160 jutaan ,neutral,neutral,neutral,neutral,positive,neutral
 kaliyan reginipun   terjangkau mobil avanza menika taksih dipunremeni masyarakat indonesia dados   mobil keluwargi pilihan ,neutral,neutral,neutral,neutral,positive,neutral
 sayang mboten wonten gps map ipun    kados versi ingkang dangu . padahal lumayan damel dhateng kondangan wonten pelosok ingkang sekel sinyal . screen mirror ugi  masa agem kabel mawon sagedipun  ,neutral,neutral,neutral,negative,neutral,neutral
 kagem njagi   performa paling sae innova menika mboten betah kathah biaya servis kados   mobil kula rumiyin   . ,neutral,neutral,neutral,neutral,neutral,positive
 kabin ngajeng tengah lan wingking miyos lega lan nyaman pajero sport dipunbanding fortuner ,neutral,neutral,neutral,negative,neutral,neutral
