sentence,fuel,machine,others,part,price,service
" bapak kula kagungan gl ingkang facelift 2013 , dumugi mriki taksih sae   , mesin taksih eca  + bensin v -power , dereng nate   tedhak mesin ",neutral,positive,positive,neutral,neutral,neutral
 pungkasan service dhateng bengkel daihatsu warsa 2016 . radi awis  sih estu   . ehe . ,neutral,neutral,neutral,neutral,neutral,negative
 sedayanipun marem sanget sih agem hrv ,neutral,neutral,positive,neutral,neutral,neutral
 mesinipun   avanza bandel lan nyaman dipunagem . ,neutral,positive,positive,neutral,neutral,neutral
" mobil avanza mboten terlau awis  , nanging kathah fitur ingkang nyengkuyung . ",neutral,neutral,neutral,positive,positive,neutral
" menawi ertiga body oke lah minimalis ngoten, nanging tarikan alon   sanget ",neutral,negative,neutral,positive,neutral,neutral
 kula dukung mobil fortuner ,neutral,neutral,positive,neutral,neutral,neutral
" honda beat sumerep sanget wonten wekdal kantong malih tipis mboten nate   rewel , mesin taksih lembat terus sanadyan saben dinten dipunasta perjalanan tebih terus ",neutral,positive,positive,neutral,neutral,neutral
 calya mlajengipun ugi  lumayan kenceng mantep jiwa ,neutral,positive,neutral,neutral,neutral,neutral
 sayangipun   veloz taksih ngagem dilah halogen sanes led nggih juragan ,neutral,neutral,neutral,negative,neutral,neutral
 hrv menika kagungan ultra seat dados asta barang ingkang jangkung utawi badhe menyembunyikan barang saged wonten ngandhap jok . keren sih . ,neutral,neutral,neutral,positive,neutral,neutral
 honda brio kelebet  ingkang cekap ekonomis wonten kelasipun   ,neutral,neutral,neutral,neutral,positive,neutral
 kaliyan service kagem konsumen daihatsu taksih miyos sae   dipunbanding toyota. ,neutral,neutral,neutral,neutral,neutral,negative
 cekap sawulan damel inden fortuner mboten sugih xpander dumugi sawarsa ,neutral,neutral,neutral,neutral,neutral,negative
 scoopy kayanipun  estu   dipundamel kagem putra timur ingkang oke pokokipun   ,neutral,neutral,positive,neutral,neutral,neutral
" remen deh kaliyan pilihan mobil avanza ingkang setunggal menika , tenaga sae   lan bandel ",neutral,positive,neutral,neutral,neutral,neutral
" 4 warsa agem altis , kebukti  sih menika mobil mesinipun   bandel sanget ",neutral,positive,neutral,neutral,neutral,neutral
 menika kula mawon ingkang rumaos bensin xenia boros sanget menapa estu   nggih sih ,negative,neutral,neutral,neutral,neutral,neutral
 pajero sport lah ! fitur safetyipun   miyos cakep daripada fortuner ,neutral,neutral,neutral,negative,neutral,neutral
" njrit , awis  sanget , vario perawatan naming betah gantos oli mesin sami gardan , menawi wonten ingkang betah dipun-gantos nggih kula gantos piyambak , kula mending pawitan sakedhik mundhut toolkits damel bingkar motor daripada dipunasta dhateng bengkel resmi , remen ngaco bengkel resmi ",neutral,neutral,neutral,neutral,neutral,negative
" chr  =  regi  selangit , fitur kirang joss ",neutral,neutral,neutral,negative,negative,neutral
 bengkel honda payah bro ! ngaret . bengkel sebelah on time . #noted ,neutral,neutral,neutral,neutral,neutral,negative
 keren pajero bro ... fortuner mah langkung .. ,neutral,neutral,negative,neutral,neutral,neutral
 yahama aerox 155 vva akselerasi estu   top. ,neutral,positive,neutral,neutral,neutral,neutral
 scoopy kece . bensin irit dipunasta tebih nggih mboten rewel . mboten kathah buang-buang arta wekdal servis . ,positive,neutral,positive,neutral,neutral,positive
" daihatsu sigra, tangki bensin rawan bocor amargi kadamel saking bahan plastik. ",neutral,neutral,neutral,negative,neutral,neutral
" midherek kula menika mobil radi cengeng sih , utawi kathah penyakit , midherek pendapat kula ",neutral,neutral,negative,neutral,neutral,neutral
" grand livina xv matic kula nyaman sanget , mboten nate   wonten masalah gadhah artos . nissan top ",neutral,neutral,positive,neutral,neutral,neutral
 altis kula  warsa 2001 istimewa sanget ,neutral,neutral,positive,neutral,neutral,neutral
 desain unibody menika maringaken kesagahan miyos dhateng avanza lebet nahan   beban lan menika salah setunggal poin dipunbandingaken kaliyan para pesaingipun   juragan ,neutral,neutral,neutral,positive,neutral,neutral
 duka  kenging menapa kula priksa mobil menika mboten proporsional saking sisi    wingking  ,neutral,neutral,neutral,negative,neutral,neutral
 midherek gw sih fortuner menang tebih saking segi kemewahanipun   daripada pajero ingkang kampungan sanget ,neutral,neutral,negative,neutral,neutral,neutral
 midherek kula pribadi : vario 150 2018 naming santun mawon . mesin lan rem kirang maremaken amargi mboten wonten peningkatan . ,neutral,negative,neutral,negative,neutral,neutral
" menawi trose tukang bengkel , xenia inggih menika mobil irit . irit bensin ( keparing 1:12 ) . ",positive,neutral,neutral,neutral,neutral,neutral
 menawi wonten hrv prestige .. mesthi juwara wonten ngriki ,neutral,neutral,positive,neutral,neutral,neutral
" rayi kula  ugi  agem hrv nanging ingkang 1500 , menawi saweg  nebeng wonten kursi wingking estu   nyaman sanget wiyar . ",neutral,neutral,neutral,positive,neutral,neutral
" kala-wau siyang pinarak dhateng dealer mobil toyota bintaro , nanya-nanipun  mobil avanza . sales girl ipun    pelayananipun   mboten ramah sanget . tiyang kados ngoten dijadiin sales mobil ",neutral,neutral,neutral,neutral,neutral,negative
 wuling confero mobil nyaman damel keluwargi . ,neutral,neutral,positive,neutral,neutral,neutral
 honda hrv cvt ipun    alon   ( mboten ngertos ingkang 1.8 ) . ,neutral,neutral,neutral,negative,neutral,neutral
 suzuki all new ertiga samenika saya    awis  ,neutral,neutral,neutral,neutral,negative,neutral
 regi  ignis sae  sanget kagem regi  mobil semriku ,neutral,neutral,neutral,neutral,positive,neutral
" toyota regi  kawisen   , kwalitet nedhak , layanan purnajual nedhak ",neutral,neutral,negative,neutral,negative,negative
 service toyota estu   mboten nate   nguciwakaken ,neutral,neutral,neutral,neutral,neutral,positive
 vario tebih miyos boros daripada mio ,negative,neutral,neutral,neutral,neutral,neutral
 suspensi eca  pajero sport bro sanes fortuner ,neutral,neutral,neutral,negative,neutral,neutral
 sanadyan honda brio bodyipun   oke nanging menawi mesinipun   mboten sae   nggih kagem menapa ,neutral,negative,neutral,positive,neutral,neutral
" toyota rush menika perawatanipun   gampil , bengkel kathah wonten pundi-pundi . ",neutral,neutral,neutral,neutral,neutral,positive
" dumugi wekdal menika brand mobil paling maremaken kula kaliyan sedayanipun : value , kwalitet mobil , purnajual taksih toyota . ",neutral,neutral,positive,neutral,positive,neutral
" remen sami brio amargi lincah lan gesit sanget kagem dipunasta dhateng pundia , calya kawon tebih pokokipun   ",neutral,negative,neutral,neutral,neutral,neutral
" gl menika midherek kula, eca  dikendarai saking perspektif pengemudi. ",neutral,neutral,positive,neutral,neutral,neutral
 wuling cortez menika kadosipun   nyaman sanget sih daripada avanza ,neutral,neutral,negative,neutral,neutral,neutral
 tresna sanget kaliyan pilihan warni honda jazz ingkang damel gemas ,neutral,neutral,neutral,positive,neutral,neutral
" kidang kapsul wiyar nanging boros bensin , avanza irit nanging ripak  , huh ",positive,neutral,neutral,negative,neutral,neutral
 kula miyos dhateng mobilio amargi saking segi tenaga miyos inggil ,neutral,positive,neutral,neutral,neutral,neutral
" mitsubishi menika mobil ingkang perawatanipun   gampil  , eca  sanget ",neutral,neutral,neutral,neutral,neutral,positive
" mantep ugi  niki ketahanan mesin mobilipun   wuling confero l, auto kathah ingkang mundhut damel taksi online. ",neutral,positive,neutral,neutral,neutral,neutral
 jazz tenaganipun  oke sanget daripada brio kawon tebih ,neutral,negative,neutral,neutral,neutral,neutral
 kula miyos cenderung vrz kagungan daya tarik piyambakan ,neutral,neutral,positive,neutral,neutral,neutral
 kajangkepan fitur sami kapasitas cc lan power ingkang miyos gede .. sirion miyos kathah keunggulan ,neutral,positive,neutral,positive,neutral,neutral
" kula agem all new honda brio satya e gan , nyaman sanget lan good , menapa malih brandipun   h , benten kaliyan suzuki ignis lan daihatsu sirion ",neutral,neutral,negative,neutral,neutral,neutral
" tulung oh   dibenahi ahasipun   , masa kula badhe servis motor lan gantos oli mekanikipun   mboten wonten . ",neutral,neutral,neutral,neutral,neutral,negative
 penilaian kula inggih menika avanza menika mobil nyaris sempurna ,neutral,neutral,positive,neutral,neutral,neutral
 kula saya    saestu kagem agem honda brio dados   mobil sadinten-dinten amargi ngremenaken  kagem dikendarai . ,neutral,neutral,positive,neutral,neutral,neutral
" samparan samparan nyaman kabin lan bagasi ugi  wiyar sanget , interior lan fitur ugi  keetang   sae   wonten kelasipun   . pokokipun   remen  lah agem hrv ",neutral,neutral,neutral,positive,neutral,neutral
" mundhut wuling confero s keparing jasa servis 2,5 warsa mboten betah bayar . ",neutral,neutral,neutral,neutral,neutral,positive
 mini taksih kawon ageng tenaganipun  dipunbanding daihatsu ayla turbo ,neutral,positive,neutral,neutral,neutral,neutral
 warni avanza keluaran paling enggal menika nambah   mobil dados   kepriksan miyos modern ,neutral,neutral,neutral,positive,neutral,neutral
" xenia warsa 2008 dipunagem sadangu 2 sasi  wongsal-wangsul jakarta -bandung , mesin mboten sapisana  wonten masalah . ",neutral,positive,neutral,neutral,neutral,neutral
" sedaya tipe pcx 2018 keren menapa malih ingkang pcx abs . keren sanget modelipun   , sae   lan canggih mesinipun   lan hemat bbm ipun    . ",positive,positive,positive,positive,neutral,neutral
" keleresan kula ugi  agem hrv , nanging pengalaman wonten bengkel resminipun  , kathah ingkang kirang ngremenaken  . saha  biaya servisipun   radi awis  . ",neutral,neutral,neutral,neutral,neutral,negative
" mboten nyana     sekelas suv 1800 cc bahan besmi 1 banding 12 lebeting kitha , irit sanget . ",positive,neutral,neutral,neutral,neutral,neutral
 city car daihatsu setunggal menika kasunyatanipun reginipun   mboten patos awis  ,neutral,neutral,neutral,neutral,positive,neutral
 @mitsubishi_id bengkel matraman kirang sae   service mobil kula . ,neutral,neutral,neutral,neutral,neutral,negative
 xpander bodi ugi  kaleng . sinten matur naming rush mawon ingkang kaleng ,neutral,neutral,neutral,negative,neutral,neutral
 honda brio rs cvt mantep bro . naming regi  radi awis  mawon sih ,neutral,neutral,positive,neutral,negative,neutral
 avanza mantep sanget poweripun   damel dipunasta dhateng margi   landhep ,neutral,positive,neutral,neutral,neutral,neutral
 brio manuveripun   lincah abis menawi dipunbanding sami calya ,neutral,negative,neutral,neutral,neutral,neutral
 purnajual wangsul toyota rush ugi  taksih sae   . ,neutral,neutral,neutral,neutral,positive,neutral
 bengkel @honda padhang anugrah pamulang payah pelayananipun   ,neutral,neutral,neutral,neutral,neutral,negative
" kula mundhut avanza 2011 , kagem regi  ergonomis sanget damel keluwargi lan kagem konsumsi bensinipun   irit . ",positive,neutral,neutral,neutral,positive,neutral
" suspensi radi atos|sora , saha dereng wonten telescopic wonten setir , mugi-mugi wonten ebah      wonten terios dhateng ajengipun   , matur nuwun  . ",neutral,neutral,neutral,negative,neutral,neutral
 menawi ingkang kula   raosaken sih performa avanza 1.5 miyos lincah lan miyos irit ,positive,positive,neutral,neutral,neutral,neutral
 avanza sih reginipun   mirah nan ramah ,neutral,neutral,neutral,neutral,positive,neutral
 honda vario kula  mirah perawatan rutin lan tansah termonitor menawi wonten kekirangan setunggal lan sanesipun   keparing terdeteksi kaliyan enggal lan malah  kathah papan  servis ingkang kesebar  ndadosaken gampil lebeting pemeliharaanipun   . ,neutral,neutral,neutral,neutral,neutral,positive
 empun wolung sasi  enggal dados dangu leres ,neutral,neutral,neutral,neutral,neutral,negative
 radi kawisen   nggih kagem sekelas brio ,neutral,neutral,neutral,neutral,negative,neutral
 konsumsi bahan besmi avanza cekap irit ,positive,neutral,neutral,neutral,neutral,neutral
" xenia li kula , warsa 2006 akhir empun vvti ungel mesinipun   kasar menawi posisi mendel . kados diesel ngoten . ",neutral,negative,neutral,neutral,neutral,neutral
" saking sadayaning merek mobil ingkang nate   kula agem , terios enggal menika lumayan boros . ",negative,neutral,neutral,neutral,neutral,neutral
" mini cooper , mobil stylish ingkang nyaketi   sempurna ",neutral,neutral,positive,neutral,neutral,neutral
 ngagungani mesin dual vvti lan sistem penggerak roda wingking ndamel  daihatsu great new xenia kagungan keunggulan lebet efisiensi lan kegampilan perawatanipun   . ,positive,neutral,neutral,neutral,neutral,positive
 kula   sampun test drive lan ngraosaken tarikan ingkang cekap mantep wonten mobil wuling menika . ,neutral,positive,neutral,neutral,neutral,neutral
 mesin wuling confero menika mboten berisik ,neutral,negative,neutral,neutral,neutral,neutral
" fortuner menawi dipunpriksa reginipun   estu   menjulang inggil . nanging wonten wingking regi  menika , kwalitet ingkang dipunparingaken ugi  sae   . ",neutral,neutral,positive,neutral,negative,neutral
 ampun deh kagungan xenia arta telas naming damel konsumsi bensin ,negative,neutral,neutral,neutral,neutral,neutral
 wah kadosipun   si wuling formo menika kirang meyakinkan damel titihan tosan dintenan. ,neutral,neutral,negative,neutral,neutral,neutral
" toyota rush kula , konsumsi bahan bakaripun   cekap irit . ",positive,neutral,neutral,neutral,neutral,neutral
" reginipun   keetang   mirah kaliyan fitur lan desain ingkang cekap keren , suzuki baleno 2017 ",neutral,neutral,neutral,positive,positive,neutral
" nggih leres mas/jeng , kelemahan mobilio naming 1 , wonten mesinipun   menawi kecepatan wonten inggil 100 kph , estu   berisik sanget sih . ",neutral,negative,neutral,neutral,neutral,neutral
" hmm pelayananipun   not recommended lah , taksih miyos sae   bengkel non-resmi ( @ astra international daihatsu ( pondok cabe )) ",neutral,neutral,neutral,neutral,neutral,negative
" wah , juragan xenia li 2004 kula rumiyin 5 warsa dereng gantos ban . taksih kandhel sedaya ",neutral,neutral,neutral,positive,neutral,neutral
" ebah      minor nggih limrah mboten minggah regi  , mboten minggah regi  mawon penjualan minim menapa malih minggah regi  . pabrikan jepang sami2 mawon pelitipun   .... ",neutral,neutral,neutral,neutral,negative,neutral
 kula miyos milih honda amargi minim perawatan lan suku    cadang ingkang awet lan mirah ,neutral,neutral,neutral,positive,neutral,positive
 livina wonten papan  kula bensinipun   asli boros sanget menawi soal ngelitik estu   nggih ,negative,negative,neutral,neutral,neutral,neutral
 kula pilih xi+ amargi kasunyatanipun iritipun   mboten benten tebih . ,positive,neutral,neutral,neutral,neutral,neutral
 wuling formo 1.2 standard ingkang ramah kagem penumpang. ,neutral,neutral,positive,neutral,neutral,neutral
 xenia kaliyan cepengan pintunipun  ingkang dipunposisikaken tengah midherek kula piyambak kirang remen sih ,neutral,neutral,neutral,negative,neutral,neutral
 menawi rush kathah jeroanipun   dados awrat nanging stabil . ,neutral,positive,neutral,negative,neutral,neutral
" veloz keluaran toyota kasunyatanipun eca  dipake , nyaman , pesen saking dealer ugi  mboten dangu indenipun   , thanks toyota :d ",neutral,neutral,positive,neutral,neutral,positive
 @auto2000id nuwun sewu kenging menapa nggih mobil nggih sasampunipun wonten servis wonten dealer toyota samenika mobilipun   dados sekel wonten starter ? lan asring seda seda ,neutral,neutral,neutral,neutral,neutral,negative
 mobil xenia mantep irit ugi  . kagem perawatanipun   mesinipun   lumayan mirah . ,positive,neutral,positive,neutral,neutral,positive
" sasampunipun mundhut toyota calya , kula ngraosaken kathah malih kalangkunganipun. ",neutral,neutral,positive,neutral,neutral,neutral
" saking segi regi  sanget-sanget awis  , ngemut-emut regi  sparepart mitsubishi xpander selangit . ",neutral,neutral,neutral,neutral,negative,neutral
 ingkang paling cocok kagem putri karir estu   calya saking segi desain amargi mungil nanging tetep terlihar stylish ,neutral,neutral,neutral,positive,neutral,neutral
" eca  ugi  bengkel toyota wonten margonda menika . sedaya petugas ramah lan helpful , layanan enggal , lan keparing kopi gratis . ",neutral,neutral,neutral,neutral,neutral,positive
" saderengipun pasa     2014 , kula gantos accu wonten bengkel honda jakarta center , jayakarta . dereng sawarsa , sampun soak . payah ",neutral,neutral,neutral,neutral,neutral,negative
 regi  unit mobil gl kawisen   ,neutral,neutral,neutral,neutral,negative,neutral
" agem rush trd eca  sanget saking bangku    , samparan samparan eca  lan kula asta plajeng kaliyan kecepatan meh    140 km / tabuh mboten limbung lan masalah bensin irit sanget lan ac asrep  ",neutral,positive,neutral,positive,positive,neutral
 agem altis v mboten boros-boros sanget sih ,positive,neutral,neutral,neutral,neutral,neutral
" menapa malih menawi perjalanan tebih , kaliyan bensin ingkang irit sanget kagem kula kados menika performa ingkang stabil , avanza inggih menika mobil idaman kagem kula saha keluwargi ageng kula . ",positive,positive,neutral,neutral,neutral,neutral
" ingkang kula mboten remen , menawi kula pinarak wonten wingking , mustaka mentok kaliyan atap kaliyan inggil 183 cm . pinarak wonten posisi mengemudi , rikma kula kepareng plafon mobil dados kirang nyaman . ",neutral,neutral,neutral,negative,neutral,neutral
 kula pribadi miyos remen sami design jawi lebet cx3 ,neutral,neutral,neutral,positive,neutral,neutral
 bagusan fortuner daripada pajero sport ,neutral,neutral,negative,neutral,neutral,neutral
 satebih menika dereng ne panjenengan bengkel resmi mitsubishi ingkang pelayanipun   ' sae   ' ,neutral,neutral,neutral,neutral,neutral,positive
 toyota miyos inggil saking mitsubishi kaliyan worldwide kelebet  wonten indonesia ,neutral,neutral,negative,neutral,neutral,neutral
" toyota innova suspensinipun  mantep sanget , mboten nate   rewel mesinipun   amargi rutin diservis . ",neutral,positive,neutral,positive,neutral,neutral
" kula agem hrv ugi  lan empun 2 warsa , jujur mboten remen sih sami menika mobil . ",neutral,neutral,negative,neutral,neutral,neutral
 rush cocok kagem sedaya medan ,neutral,neutral,positive,neutral,neutral,neutral
" xenia li sampun wonten power window , tachometer , power steering ",neutral,neutral,neutral,positive,neutral,neutral
" mligi  xenia , wonten pengalaman warsa 2008 dipunagem dening tim proyek . sadangu 2 sasi  , jakarta -bandung saben  2 dinten via tol . mboten wonten keluhan sakedhik nggih . ",neutral,neutral,positive,neutral,neutral,neutral
 altis g mt dados titihan nyaman . ,neutral,neutral,positive,neutral,neutral,neutral
 sedayanipun kula remen kaliyan terios . ,neutral,neutral,positive,neutral,neutral,neutral
 pengalaman hrv 1.5 e cvt . mboten marem sanget ,neutral,neutral,negative,neutral,neutral,neutral
 mugi-mugi berkembang toyota supados gk ditinggalin customeripun   setunggal per setunggal ,neutral,neutral,negative,neutral,neutral,neutral
 xpander pokokipun   paling sae wonten kelasipun   . ,neutral,neutral,positive,neutral,neutral,neutral
 marem sanget coi kagungan xpander mah . ,neutral,neutral,positive,neutral,neutral,neutral
 xi 2005 hebat sanget niki mobil . kiyat agem premium ( 1:11 ) irit abis ,positive,neutral,positive,neutral,neutral,neutral
" sedayanipun kula remen xenia . mirah , desain lucu , amot kathah barang , ",neutral,neutral,positive,positive,positive,neutral
" cobi oh   dhateng honda autoland klapa  gading , benten leres . pelayanan , kwalitet ruang tengga lan sanes-sanes ingkang mboten sanget . ",neutral,neutral,neutral,neutral,neutral,negative
" rama kula ngertos karakter mesin , panjenenganipun matur karakter mesinipun   calya oke ",neutral,positive,neutral,neutral,neutral,neutral
 calya didesain keparing dipunagem kagem sadayaning kalangan yuswa ,neutral,neutral,neutral,positive,neutral,neutral
 jazz vtec dangu mawon miyos mirah ,neutral,neutral,neutral,neutral,positive,neutral
 avanza keparing bermanuver lincah mesinipun   ,neutral,positive,neutral,neutral,neutral,neutral
 avanza lincah sanget menawi damel plajeng sanadyan gayanipun  jadul abis hehe ,neutral,positive,neutral,negative,neutral,neutral
" kula keparing regi  naming 118 yuta juli 2015 . lumayan mirah sanget si wagon , awet , irit . ",positive,neutral,positive,neutral,positive,neutral
 kula badhe pilih all new grand livina . kantenan miyos nyaman . miyos mewah . miyos keren . mobilipun   putra timur malih . ,neutral,neutral,positive,neutral,neutral,neutral
 elektronik parking brake hrv sampun oke sanget . ,neutral,neutral,neutral,positive,neutral,neutral
" kados   menika lah raos mengendarai nissan gt -r r35 "" godzilla "" bertenaga 537 hp kaliyan torsi 612 nm ingkang estu    kenceng ",neutral,positive,neutral,neutral,neutral,neutral
 mobil sae   irit bahan besmi lan mirah nggih brio ,positive,neutral,positive,neutral,positive,neutral
 honda brio menika mobil ingkang lumayan keren sih estu   ,neutral,neutral,positive,neutral,neutral,neutral
 masalah nopol mawon dangu sanget mengurusipun   kecewa sami nissan ,neutral,neutral,neutral,neutral,neutral,negative
" motor beat paling nyaman , dipunagem kagem putri kados   kula , menapa malih dipunasta dhateng pundi-pundi irit sanget lan reginipun   terjangkau dipunbandingaken motor honda ingkang sanes . ",neutral,neutral,positive,neutral,positive,neutral
" hrv prestige akhir warsa 2017 bagasi wiyar , bbm irit saged 1:12 , jok kulit , dilah led eca  menawi dipunagem dalu  dinten . ",positive,neutral,neutral,positive,neutral,neutral
" kaliyan regi  naming 70 -80 yuta keparing mobil ingkang nyaman sanget , naming altis ingkang saged ",neutral,neutral,positive,neutral,positive,neutral
 remen sanget sami fitur paddle shift ipun    hrv e 2018 kados mobil balap menawi asta wonten tol suwanten mesinipun   . ,neutral,positive,neutral,positive,neutral,neutral
" xenia ingkang kula agem saking 2005 menika biaya perawatan ingkang andhap lan keandalan mesin ingkang inggil , ",neutral,positive,neutral,neutral,neutral,positive
 hrv nyaman utaminipun pas menyetir dalu  amargi lampunipun  padhang ( double led ) lan ingkang kantenan irit . ,positive,neutral,positive,positive,neutral,neutral
 regi  sade nmax nggih saingan  ,neutral,neutral,neutral,neutral,positive,neutral
" kaliyan sigra perjalanan miyos nyaman, budget bensin saged dipunalokasikaken kagem perlu     sanes. ",positive,neutral,positive,neutral,neutral,neutral
" menawi kagem kaliyan desain , interior lan fitur honda mumpuni okelah . ",neutral,neutral,neutral,positive,neutral,neutral
" dhateng bengkel menika damel ngebenerin motor sanes malah damel motor dados risak , payah niki dealer honda cidodol , masa motor gua leres dados risak .",neutral,neutral,neutral,neutral,neutral,negative
kawisen   nggih agya menawi kagem keluwargi kaliyan ekonomi pas-pasan ,neutral,neutral,neutral,neutral,negative,neutral
 menawi soal irit lan perawatan sih tetep prefer dhateng supra x helm in . ,positive,neutral,neutral,neutral,neutral,positive
" sigra niki ngancani {margi-margi, mlampah-mlampah} sareng  keluwargi. kula  bingah kaliyan mobil menika. ",neutral,neutral,positive,neutral,neutral,neutral
" mobil kula  daihatsu xenia kula  irit , cocok sanget damel keluwargi indonesia kaliyan kursi 7 tambah malih mesin handal ( 1.300 cc ) sanadyan sampun wiwit 2009 ",positive,positive,neutral,positive,neutral,neutral
 marem nalika kaping sapisan mundhut lan ngagem toyota calya menika ngantos samenika ,neutral,neutral,positive,neutral,neutral,neutral
 kerenan pajero lah ingkang kersa like nggih ,neutral,neutral,positive,neutral,neutral,neutral
 miyos ok pajero .... miyos jantan ,neutral,neutral,positive,neutral,neutral,neutral
" kula agem motor vario nyaman sanget , rem pakem sanget , suwanten mesin montor taksih lembat , padahal saben  sasi  dipundamel {margi, mlampah} jawining propinsi nanging taksih tetep nyaman . ",neutral,positive,positive,positive,neutral,neutral
 gumantung  badhe pakainipun  pinten dangu . menawi 2 -3 warsa kersa gantos mending brio bro amargi regi  honda tedhak mboten tebih-tebih sanget . ,neutral,neutral,neutral,neutral,positive,neutral
" nanging sadangu ingkang kula priksa menawi xenia avanza tubruk ( aben menda   ) , perangan kabin kepriksan taksih kokoh . ",neutral,neutral,neutral,positive,neutral,neutral
 rush lan terios tampilan mawon sae   nanging kwalitet mirahan . mendingan mundhut cortez nyaman dipunasta lan mirah . ,neutral,neutral,positive,positive,positive,neutral
" alesan kula pilih hrv amargi betah mobil ingkang jangkung , lega wonten kelasipun   , lan modelipun   bagus   . ",neutral,neutral,neutral,positive,neutral,neutral
" honda jazz full power sanget, body mantep, suspensi empuk lan nyaman. ",neutral,positive,neutral,positive,neutral,neutral
 asma toyota lan honda wonten indonesia melegenda ... sanadyan awis  tiyang badhe mundhut ... tembungipun spert partipun   mirah padahal kualitasipun   abal2 ... wonten ketok sakedhik langsung penyot bodyipun   lan dasboripun   ,neutral,neutral,neutral,negative,neutral,neutral
 xenia perawatan berkalanipun  mboten awis  . ,neutral,neutral,neutral,neutral,neutral,positive
 awon  sanget menika xenia li menesal kula mundhut ,neutral,neutral,negative,neutral,neutral,neutral
 jujur mawon tenaganipun  mobilio miyos ageng ingkang manual lan akselerasinipun  miyos enggal ,neutral,positive,neutral,neutral,neutral,neutral
" beat street saking bentukan keren sanget , eye catching , saking performa ugi  lumayan kagem motor seharganipun  , mesin senyap lan saestu      lembat . ",neutral,positive,neutral,positive,neutral,neutral
 brio kula kondisi mesin saged dipunetang taksih sempurna taksih saged 28 km / liter lan digas dhateng 120 kmh 140 kmh ugi  taksih enteng . ,neutral,positive,neutral,neutral,neutral,neutral
